{"created_at":"2026-08-29T00:00:00Z","dataset_id":"atlas-research-fixture-v1","record_schema":{"id":"urn:atlasrepo:atlas-research:record:v1:scoring-example","version":"1.0.0"},"schema_version":"1.0.0","seed":7,"source_artifacts":[{"external_schema":{"id":"urn:atlasrepo:example:synthetic-scoring-export:v1","version":"1.0.0"},"media_type":"application/x-ndjson","producer":{"name":"atlas-research-fixture","version":"1.0.0"},"role":"source_export","sha256":"59369afaa63fca52a03a41c2274370e3209afeed940ec54883082597617e9c7b","size_bytes":165,"uri":"source.jsonl"}],"split_method":"sha256-id-v1","split_ratios":{"test":0.1,"train":0.8,"validation":0.1},"splits":{"test":{"artifact":{"external_schema":{"id":"urn:atlasrepo:atlas-research:record:v1:scoring-example","version":"1.0.0"},"media_type":"application/x-ndjson","producer":{"name":"atlas-research","version":"0.1.0"},"role":"dataset_split","sha256":"4e6ea74725cbca8573c3eaf1ddbb5b30fcc0182ac7b2a6bab4766e55e359f473","size_bytes":55,"uri":"test.jsonl"},"record_count":1,"sealed":true},"train":{"artifact":{"external_schema":{"id":"urn:atlasrepo:atlas-research:record:v1:scoring-example","version":"1.0.0"},"media_type":"application/x-ndjson","producer":{"name":"atlas-research","version":"0.1.0"},"role":"dataset_split","sha256":"556b25c4416d155b6a21b482a44845e521ec88a36d2539044ba2d18e62c56438","size_bytes":55,"uri":"train.jsonl"},"record_count":1,"sealed":false},"validation":{"artifact":{"external_schema":{"id":"urn:atlasrepo:atlas-research:record:v1:scoring-example","version":"1.0.0"},"media_type":"application/x-ndjson","producer":{"name":"atlas-research","version":"0.1.0"},"role":"dataset_split","sha256":"13898f4bdea9591de2268e12926db2bb1b915c2dbb40d7cd8416c8bef830287b","size_bytes":55,"uri":"validation.jsonl"},"record_count":1,"sealed":false}}}
